{
  "schemaVersion": 1,
  "snapshotId": "wikipedia-fa-240303-r44480580",
  "sourceType": "wikipedia",
  "sourceId": "wikipedia-fa",
  "requestedUrl": "https://fa.wikipedia.org/wiki/%DA%A9%D8%A7%D9%81%D8%A6%DB%8C%D9%86",
  "retrievedAt": "2026-09-25T09:07:17Z",
  "fromSource": {
    "title": "کافئین",
    "language": "fa",
    "pageId": 240303,
    "revisionId": 44480580,
    "revisionTimestamp": "2026-09-24T05:57:08Z",
    "canonicalUrl": "https://fa.wikipedia.org/wiki/%DA%A9%D8%A7%D9%81%D8%A6%DB%8C%D9%86",
    "wikidataId": "Q60235",
    "license": {
      "url": "https://creativecommons.org/licenses/by-sa/4.0/deed.fa",
      "text": "Creative Commons Attribution-Share Alike 4.0"
    },
    "contentType": "text/html; charset=utf-8; profile=\"https://www.mediawiki.org/wiki/Specs/HTML/2.8.0\""
  },
  "fromConfig": {
    "publisher": "ویکی‌پدیا",
    "derivatives": "share-alike",
    "license": "CC BY-SA 4.0",
    "licenseUrl": "https://creativecommons.org/licenses/by-sa/4.0/",
    "language": "fa"
  },
  "derived": {
    "canonicalUrl": "https://fa.wikipedia.org/wiki/%DA%A9%D8%A7%D9%81%D8%A6%DB%8C%D9%86",
    "title": "کافئین",
    "language": "fa",
    "licenseStatus": "explicit",
    "license": "CC BY-SA 4.0",
    "usableForDanak": true,
    "notUsableBecause": [],
    "extractor": "wikipedia-parsoid/1",
    "blockCount": 20,
    "characterCount": 5651,
    "contentSha256": "b495807df03289596803df02a6c29e0c90464d22a7750bf35acb93b424a88175"
  },
  "content": {
    "trust": "untrusted-source-text",
    "format": "blocks/1",
    "blocks": [
      {
        "type": "paragraph",
        "text": "کافئین (به انگلیسی: Caffeine) یک ماده شیمیایی خوراکی است که به‌طور طبیعی در گیاهان گوناگونی از جمله قهوه، کاکائو، کولا و چای یافت می‌شود و نوعی داروی محرک است که می‌تواند از خوابیدن جلوگیری کند. این ماده با ۲ دوز ۴۰۰ و ۲۰۰ میلی گرم در اکثریت داروخانه های ایران یافت می شود. کافئین یک آلکالوئید از خانواده متیل‌گزانتین‌ ها است که خواص آن به تئوفیلین و تئوبرومین هم شبیه است. کافئین خالص (آزمایشگاهی)، به صورت پودر سفید رنگ و تلخ می‌باشد. این ماده از ترکیب کربن، هیدروژن، نیتروژن و اکسیژن تشکیل شده است."
      },
      {
        "type": "paragraph",
        "text": "کافئین پرمصرف‌ترین ماده دارویی روان انگیز در میان انسان‌ها به‌شمار می‌رود که تقریباً ۹۰ درصد انسان‌ها به‌طور روزانه (اغلب در چای و قهوه) از آن استفاده می‌کنند. افزایش سوخت‌وساز بدن، تحریک سیستم اعصاب مرکزی و افزایش میزان هوشیاری، تمرکز، حافظه و آگاهی محیطی از مهم‌ترین آثار کافئین است. کافئین به صورت قرص نیز موجود است که دقیقاً همان خواص و آثار کافئین طبیعی را دارد. این فرآورده در ایران با دوز ۲۰۰ میلی‌گرم به فروش می‌رسد."
      },
      {
        "type": "heading",
        "level": 2,
        "text": "خواص فیزیکی"
      },
      {
        "type": "paragraph",
        "text": "کافئین خالص پودر نرم، بی‌بو، سفید و براقی است. نقطه جوش آن ۲۳۸ درجه سانتیگراد و نقطه ذوب آن ۱۷۸ درجه سانتیگراد است. وزن مخصوص کافئین ۲/۱ است. PH آن ۹/۶ می‌باشد. چگالی آن هم ۷/۶ است. منبع اصلی کافئین بین مواد غذایی مختلف، دانه قهوه می‌باشد. محتوای کافئین در مواد غذایی بسیار متغیر است. در سال ۲۰۰۴م، در اتیوپی درختانی پیدا شد که یک پانزدهم گیاهان کافئین دار، کافئین داشتند. احتمالاً در آینده نزدیک، از این گیاهان جدید برای تهیه نوشیدنیهای قهوه که میزان کمتری کافئین داشته باشند، استفاده می‌شود."
      },
      {
        "type": "paragraph",
        "text": "یک دوز کافئین تقریباً ۱۰۰ میلی‌گرم است که ۱۵۰ میلی لیتر نوشیدنی قهوه یا یک عدد قرص کافئین، حاوی این مقدار کافئین است. قهوه‌ها از نظر میزان کافئین بسیار باهم متفاوتند. یک فنجان قهوه می‌تواند بین ۷۵ تا ۲۵۰ میلی‌گرم کافئین داشته باشد. چای سیاه نسبت به قهوه حاوی کافئین کمتری است که البته به روش دم کردن آن بستگی دارد. چای سبز خیلی کم کافئین دارد. نوشابه‌ها معمولاً کمتر از قهوه کافئین دارند، اما برخی نوشابه‌های انرژی‌زا خیلی زیاد کافئین دارند (در تهیه نوشیدنیهای غیر الکلی، میزان کافئین موجود در آنها توسط سازندگان به دقت کنترل می‌شود. معمولاً هر چه میزان کافئین این نوع نوشیدنیها بالاتر باشد، محبوبیت آنها بیشتر می‌شود)"
      },
      {
        "type": "heading",
        "level": 2,
        "text": "تأثیرات"
      },
      {
        "type": "heading",
        "level": 3,
        "text": "تأثیر کافئین بر روی سلول‌های چربی"
      },
      {
        "type": "paragraph",
        "text": "کافئین حاوی آلکالوئیدی به نام متیل‌گزانتین است. باور بر این است که این ماده شیمیایی در کافئین گیرنده‌های آدنوزین یا گیرنده‌هایی را که به ما می‌گویند چه زمانی به خواب برویم، مختل می‌کند. در واقع این همان چیزی است که هوشیاری، تمرکز و حافظه بهتر موقتی پس از نوشیدن یک فنجان قهوه را موجب می‌شود. این اختلال و وقفه به دوپامین اجازه می‌دهد که برای مدت زمان طولانی‌تری در بدن باقی بماند و به حفظ احساس خوب کمک کند. با این وجود، نوشیدن بیش از حد قهوه می‌تواند به تحریک‌پذیری و عصبی شدن فرد منجر شود.کافئین از سد خونی-مغزی عبور کرده و طیف نسبتاً گسترده‌ای از فواید و عوارض را بر سیستم اعصاب مرکزی و پیرامونی انسان می‌گذارد که شایع‌ترین آن همان افزایش تمرکز و هوشیاری است. دوزهای بالای کافئین ممکن است باعث سرخوشی شود. در برخی از کشورهای محدود کافئین را نوعی ماده نیمه مخدر یا حتی مخدر طبقه‌بندی کرده‌اند، اگرچه که مصرف آن کاملاً آزاد است. اثرات لیپولیتیک از کافئین و گزانتین دیگر مشتق شده از چای و قهوه به خوبی ثابت شده و کاملاً شناخته شده است. به بررسی دو سازوکار کافئین می‌پردازیم. اولی تضاد گیرنده A1-آدنوزین است. این گیرنده‌ها در سلولهای چربی بالغ، جایی که آنها به مهار فعالیت سیکلاز و تجزیه چربی می‌پردازند قرار دارند. گزانتین همچنین فعالیت‌های فسفودی استراز را مهار و از فروپاشی مکان‌های داخل سلولی تجزیه چربی در سلول‌های چربی جلوگیری می‌کند. مصرف کافئین گردش غلظت چربی و غلظت FFAs سرم را افزایش می‌دهد. به این ترتیب، مصرف زیاد گزانتین نیز ممکن است به از دست دادن وزن کمک کند و ثابت ماندن وزن از طریق افزایش اکسیداسیون چربی و گرمازایی را در پی داشته باشد."
      },
      {
        "type": "heading",
        "level": 3,
        "text": "عوارض جانبی کافئین"
      },
      {
        "type": "paragraph",
        "text": "کافئین از جذب مواد معدنی خصوصاً آهن جلوگیری می‌کند و با توجه به اثر آن بر انقباض عروق خونی ، اختلال کبدی ،تنگی تنفس، مشکلات کبدی ، ضربان قلب ، مصرف آن برای مبتلایان به فشار خون، با ریسک بالا همراه است."
      },
      {
        "type": "paragraph",
        "text": "جنبه‌های منفی:"
      },
      {
        "type": "paragraph",
        "text": "برخی از عوارض جانبی ناشی از مصرف بیش از حد کافئین شامل اضطراب، بی‌قراری، لرزش، ضربان قلب نامنظم و مشکل در به خواب رفتن است."
      },
      {
        "type": "paragraph",
        "text": "در برخی از افراد، کافئین زیاد ممکن است باعث سردرد، میگرن و فشار خون بالا شود."
      },
      {
        "type": "paragraph",
        "text": "هم چنین، کافئین می‌تواند به راحتی از جفت عبور کند و خطر سقط جنین یا به دنیا آمدن نوزاد با وزن کم را افزایش دهد. زنان باردار باید میزان مصرف خود را محدود کنند."
      },
      {
        "type": "heading",
        "level": 2,
        "text": "سایر اثرات"
      },
      {
        "type": "paragraph",
        "text": "کافئین موجود در قهوه یا سایر نوشیدنی‌های دارای کافئین، می‌تواند بر تحرک دستگاه گوارش و ترشح اسید معده تأثیر بگذارد. در زنان یائسه، مصرف زیاد کافئین می‌تواند پوکی استخوان را تسریع نماید. مصرف دوزهای بالای کافئین - معمولاً بیشتر از ۳۰۰ میلی‌گرم - می‌تواند باعث ایجاد اضطراب شده یا این عارضه را در افراد مبتلا به اضطراب، افزایش دهد. در برخی از افراد، قطع کردن روند مصرف کافئین می‌تواند به‌طور قابل‌توجهی اضطراب را کاهش دهد."
      },
      {
        "type": "paragraph",
        "text": "مصرف کافئین در دوزهای متوسط، با کاهش علائم افسردگی و کاهش خطر خودکشی همراه بوده است. ۲ بررسی نشان می‌دهد که افزایش مصرف قهوه و کافئین، ممکن است خطر افسردگی را کاهش دهد. احتمال داده می‌شود که کافئین، توانایی نورون حفاظی (حفاظت از نورون‌ها) در برابر بیماری آلزایمر و زوال عقل داشته باشد هر چند، شواهد در این زمینه قطعی نیستند. مصرف منظم کافئین همچنین ممکن است از افراد در برابر سیروز کبدی محافظت کند. اگر کافئین چند ساعت قبل از رسیدن به ارتفاع بالا مصرف شود، ممکن است شدت اثر ارتفاع‌زدگی (یا کوه‌زدگی) را کاهش دهد. یک فراتحلیل نشان داده است که مصرف کافئین با کاهش خطر ابتلا به دیابت نوع ۲ مرتبط است. مصرف منظم کافئین همچنین ممکن است خطر ابتلا به بیماری پارکینسون را کاهش یا سرعت پیشرفت آن را کند نماید."
      },
      {
        "type": "paragraph",
        "text": "کافئین فشار داخل چشم را در افراد مبتلا به آب‌سیاه افزایش می‌دهد هر چند، به نظر نمی‌رسد که بر افراد عادی تأثیر بگذارد."
      },
      {
        "type": "heading",
        "level": 2,
        "text": "بیش‌مصرفی"
      },
      {
        "type": "paragraph",
        "text": "مصرف ۱ تا ۱/۵ گرم (معادل ۱۰۰۰ تا ۱۵۰۰ میلی‌گرم) کافئین در روز، با وضعیتی به نام کافئینیسم مرتبط است. بیش‌مصرفی کافئین که مصادف با کافئینیسم می‌باشد معمولاً با طیف گسترده‌ای از علائم ناخوشایند مثل عصبی‌بودن، تحرک‌پذیری، بی‌قراری، بی‌خوابی، سردرد و تپش قلب همراه است."
      }
    ]
  }
}
